{
  "airport_name": "Vion International Airport",
  "airport_code": "VIA",
  "knowledge_base_description": "Fictional knowledge base for Vion International Airport created for the multimodal passenger assistance chatbot. All records are synthetic and intended solely for research and evaluation.",
  "records": [
    {
      "id": "gate_b12",
      "name": "Gate B12",
      "category": "gate",
      "terminal": "Terminal 1",
      "floor_or_zone": "Floor 2, Zone B",
      "description": "Boarding gate B12, used mainly for short-haul European departures.",
      "opening_hours": "Open during scheduled flights only",
      "directions": "From the central security exit, follow signs to Zone B and continue straight for about 200 metres. Gate B12 is on the right.",
      "accessibility": "Step-free access via elevator near Zone B entrance. Wheelchair assistance available on request.",
      "related_facilities": [
        "restroom_b",
        "restaurant_t2",
        "information_desk_t1"
      ],
      "contact": null,
      "visual_description": "gate sign with letter and number B12, departure gate signage, boarding gate board with flight information",
      "keywords": [
        "gate",
        "boarding",
        "departure",
        "terminal 1",
        "zone b",
        "short-haul",
        "european"
      ]
    },
    {
      "id": "gate_a05",
      "name": "Gate A05",
      "category": "gate",
      "terminal": "Terminal 1",
      "floor_or_zone": "Floor 2, Zone A",
      "description": "Boarding gate A05, used for domestic departures.",
      "opening_hours": "Open during scheduled flights only",
      "directions": "From security, turn left towards Zone A. Gate A05 is the fifth gate on the left.",
      "accessibility": "Step-free access. Priority seating available near the gate.",
      "related_facilities": [
        "restroom_b",
        "information_desk_t1"
      ],
      "contact": null,
      "visual_description": "gate sign A05, domestic departure gate signage, illuminated gate number board",
      "keywords": [
        "gate",
        "boarding",
        "departure",
        "terminal 1",
        "zone a",
        "domestic"
      ]
    },
    {
      "id": "gate_c22",
      "name": "Gate C22",
      "category": "gate",
      "terminal": "Terminal 2",
      "floor_or_zone": "Floor 3, Zone C",
      "description": "Boarding gate C22, used for long-haul international departures.",
      "opening_hours": "Open during scheduled flights only",
      "directions": "Take the inter-terminal train to Terminal 2, then follow signs to Zone C on Floor 3. Gate C22 is near the far end.",
      "accessibility": "Step-free access via elevators. Accessible restrooms nearby.",
      "related_facilities": [
        "lounge_t2",
        "restroom_b",
        "information_desk_t2"
      ],
      "contact": null,
      "visual_description": "gate sign C22, international departure gate signage, digital screen showing flight number and boarding time",
      "keywords": [
        "gate",
        "boarding",
        "departure",
        "terminal 2",
        "zone c",
        "international",
        "long-haul"
      ]
    },
    {
      "id": "checkin_t1_intl",
      "name": "Terminal 1 International Check-in",
      "category": "check_in",
      "terminal": "Terminal 1",
      "floor_or_zone": "Floor 1, Departures Hall",
      "description": "Check-in desks for international flights departing from Terminal 1, including bag drop before security.",
      "opening_hours": "04:00 - 23:00 daily",
      "directions": "Enter through the main Terminal 1 departures entrance. Check-in desks are directly ahead in rows 1 to 20.",
      "accessibility": "Level access throughout. Dedicated assistance desk at row 1.",
      "related_facilities": [
        "security_t1",
        "information_desk_t1",
        "special_assistance_t1"
      ],
      "contact": "+00 000 100 100",
      "visual_description": "check-in counter with desks and queue barriers, airline check-in sign, departures hall with check-in rows",
      "keywords": [
        "check-in",
        "check in",
        "desk",
        "international",
        "terminal 1",
        "departures",
        "bag drop"
      ]
    },
    {
      "id": "checkin_t1_domestic",
      "name": "Terminal 1 Domestic Check-in",
      "category": "check_in",
      "terminal": "Terminal 1",
      "floor_or_zone": "Floor 1, Departures Hall",
      "description": "Check-in desks for domestic flights in Terminal 1.",
      "opening_hours": "05:00 - 22:00 daily",
      "directions": "From the main entrance, turn right towards rows 21 to 30 for domestic check-in.",
      "accessibility": "Level access. Self-service kiosks at accessible height available.",
      "related_facilities": [
        "security_t1",
        "information_desk_t1"
      ],
      "contact": "+00 000 100 100",
      "visual_description": "domestic check-in desks, self-service check-in kiosks, airline counter signage",
      "keywords": [
        "check-in",
        "check in",
        "desk",
        "domestic",
        "terminal 1",
        "kiosk",
        "self-service"
      ]
    },
    {
      "id": "baggage_claim_t1",
      "name": "Terminal 1 Baggage Claim Hall",
      "category": "baggage_claim",
      "terminal": "Terminal 1",
      "floor_or_zone": "Floor 0, Arrivals",
      "description": "Baggage reclaim hall for Terminal 1 arrivals, with carousels 1 to 6.",
      "opening_hours": "Open 24 hours",
      "directions": "After passport control, follow the 'Baggage Reclaim' signs down one level. The hall is straight ahead.",
      "accessibility": "Step-free access via ramp and elevator. Low-height trolleys available.",
      "related_facilities": [
        "lost_and_found",
        "customs_t1",
        "taxi_pickup"
      ],
      "contact": null,
      "visual_description": "baggage claim symbol with suitcase icon, luggage carousel conveyor belt, baggage reclaim hall sign",
      "keywords": [
        "baggage",
        "luggage",
        "baggage claim",
        "reclaim",
        "carousel",
        "terminal 1",
        "arrivals"
      ]
    },
    {
      "id": "baggage_claim_t2",
      "name": "Terminal 2 Baggage Claim Hall",
      "category": "baggage_claim",
      "terminal": "Terminal 2",
      "floor_or_zone": "Floor 0, Arrivals",
      "description": "Baggage reclaim hall for Terminal 2 international arrivals, carousels 7 to 12.",
      "opening_hours": "Open 24 hours",
      "directions": "Follow 'Baggage Reclaim' signs after customs in Terminal 2. Take the elevator to Floor 0.",
      "accessibility": "Fully step-free. Assistance staff available on request.",
      "related_facilities": [
        "lost_and_found",
        "customs_t1"
      ],
      "contact": null,
      "visual_description": "suitcase baggage symbol, conveyor belt luggage carousel, arrivals baggage reclaim signage",
      "keywords": [
        "baggage",
        "luggage",
        "baggage claim",
        "reclaim",
        "carousel",
        "terminal 2",
        "arrivals",
        "international"
      ]
    },
    {
      "id": "security_t1",
      "name": "Terminal 1 Security Control",
      "category": "security",
      "terminal": "Terminal 1",
      "floor_or_zone": "Floor 1, after Check-in",
      "description": "Central security screening checkpoint for all Terminal 1 departures, where passengers should expect a queue or line, especially at peak times.",
      "opening_hours": "04:00 - 23:30 daily",
      "directions": "After checking in, proceed straight ahead past the departures boards to the security entrance.",
      "accessibility": "Accessible lane available. Staff trained to assist passengers with reduced mobility.",
      "related_facilities": [
        "checkin_t1_intl",
        "information_desk_t1"
      ],
      "contact": null,
      "visual_description": "security checkpoint sign, x-ray scanner and metal detector gate, security control signage with guard symbol",
      "keywords": [
        "security",
        "screening",
        "checkpoint",
        "control",
        "terminal 1",
        "x-ray"
      ]
    },
    {
      "id": "information_desk_t1",
      "name": "Terminal 1 Information Desk",
      "category": "information_desk",
      "terminal": "Terminal 1",
      "floor_or_zone": "Floor 1, Departures Hall (centre)",
      "description": "Staffed information desk providing general help, directions, and flight guidance in Terminal 1, including assistance with missed connections and rebooking.",
      "opening_hours": "06:00 - 22:00 daily",
      "directions": "Located in the centre of the Terminal 1 departures hall, beneath the main flight information display.",
      "accessibility": "Level access. Hearing loop installed. Multilingual staff where available.",
      "related_facilities": [
        "checkin_t1_intl",
        "special_assistance_t1"
      ],
      "contact": "+00 000 100 200",
      "visual_description": "information desk sign with letter i symbol, help desk counter, airport information point signage",
      "keywords": [
        "information",
        "info desk",
        "help",
        "assistance",
        "terminal 1",
        "directions"
      ]
    },
    {
      "id": "information_desk_t2",
      "name": "Terminal 2 Information Desk",
      "category": "information_desk",
      "terminal": "Terminal 2",
      "floor_or_zone": "Floor 1, Arrivals (centre)",
      "description": "Staffed information desk for Terminal 2 passengers, including assistance with missed connections and rebooking.",
      "opening_hours": "06:00 - 22:00 daily",
      "directions": "In the centre of the Terminal 2 arrivals area, opposite the exit doors.",
      "accessibility": "Level access. Hearing loop installed.",
      "related_facilities": [
        "lounge_t2",
        "special_assistance_t1"
      ],
      "contact": "+00 000 100 201",